{
  "schema": "promodeler-outfit/1.0",
  "id": "haruka-riding-suit",
  "base_character": "woman",
  "name": "春香用・胸元開閉のセパレートライダース",
  "source": {
    "kind": "blueprint",
    "path": "blueprints/japan-realistic-v1/37-haruka-riding-suit/blueprint.json",
    "sha256": "bf8bb14e911e7d6c73e68538569dac94fd2d82cff30ea4181a931b9f4d8cc82e",
    "generator_version": 1,
    "catalog_version": "2f6d334150ab"
  },
  "body_policy": "keep",
  "barefoot": false,
  "wardrobe": [
    {
      "slot": "upper",
      "catalog_id": "leather_jacket_separate_01",
      "blueprint_garment": "jacket",
      "name": "セパレート革ジャケット",
      "material": {
        "base_color_srgb": "#242225",
        "roughness": [
          0.3,
          0.48
        ],
        "metallic": 0
      },
      "finished_measurements_m": {
        "back_length": 0.37,
        "bust_circumference": 0.96,
        "waist_circumference": 0.65,
        "shoulder_width": 0.385,
        "sleeve_length": 0.55,
        "leather_thickness": 0.0011
      },
      "deformation": "skinned_with_secondary_cloth",
      "construction": "左右前身頃は胸ダーツ/曲面パネル。背身頃と袖を分離、肘にストレッチパネル。上下を縫合しない。ウエスト隠し連結ファスナーは着脱式。",
      "sole_height_m": null,
      "heel_height_m": null,
      "internal_length_m": null,
      "controls": {}
    },
    {
      "slot": "lower",
      "catalog_id": "leather_pants_highwaist_01",
      "blueprint_garment": "pants",
      "name": "ハイウエスト革パンツ",
      "material": {
        "base_color_srgb": "#242225",
        "roughness": [
          0.3,
          0.48
        ],
        "metallic": 0
      },
      "finished_measurements_m": {
        "waist_circumference": 0.63,
        "hip_circumference": 0.93,
        "inseam": 0.72,
        "knee_circumference": 0.39,
        "hem_circumference": 0.28,
        "leather_thickness": 0.0011
      },
      "deformation": "skinned_with_correctives",
      "construction": "股下マチ、膝前曲げダーツ、膝裏ストレッチ、左脇開閉。腰高はY1.02m。",
      "sole_height_m": null,
      "heel_height_m": null,
      "internal_length_m": null,
      "controls": {}
    },
    {
      "slot": "inner",
      "catalog_id": "support_lining_01",
      "blueprint_garment": "support",
      "name": "内蔵支持ライニング",
      "material": {
        "base_color_srgb": "#302D31",
        "roughness": [
          0.65,
          0.8
        ],
        "metallic": 0
      },
      "finished_measurements_m": {
        "underbust_circumference": 0.7,
        "band_width": 0.035,
        "thickness": 0.0008
      },
      "deformation": "skinned",
      "construction": "不透明な左右カップと下縁バンドを内蔵、胸開口の内側に収める。ファスナーが開いてもカップを保持。",
      "sole_height_m": null,
      "heel_height_m": null,
      "internal_length_m": null,
      "controls": {}
    },
    {
      "slot": "hands",
      "catalog_id": "gloves_leather_01",
      "blueprint_garment": "gloves",
      "name": "左右グローブ",
      "material": {
        "base_color_srgb": "#242225",
        "roughness": [
          0.3,
          0.48
        ],
        "metallic": 0
      },
      "finished_measurements_m": {
        "palm_length": 0.085,
        "middle_finger_length": 0.073,
        "cuff_length": 0.045,
        "thickness": 0.0008
      },
      "deformation": "skinned",
      "construction": "5指を分離、指関節の折り、掌の薄い補強。",
      "sole_height_m": null,
      "heel_height_m": null,
      "internal_length_m": null,
      "controls": {}
    },
    {
      "slot": "footwear",
      "catalog_id": "boots_short_leather_01",
      "blueprint_garment": "boots",
      "name": "左右ショートブーツ",
      "material": {
        "base_color_srgb": "#242225",
        "roughness": [
          0.3,
          0.48
        ],
        "metallic": 0
      },
      "finished_measurements_m": {
        "shaft_height": 0.2,
        "upper_thickness": 0.0015
      },
      "deformation": "skinned",
      "construction": "踵カウンター、内側ファスナー、足首パッド、屈曲部。",
      "sole_height_m": 0.035,
      "heel_height_m": null,
      "internal_length_m": 0.247,
      "controls": {}
    }
  ],
  "hair_override": {
    "style": "hair_low_ponytail_01",
    "base_color_srgb": null,
    "length_m": null
  },
  "extra_bones": [
    "zipper-front",
    "waist-tab.L",
    "waist-tab.R"
  ],
  "controls": {
    "front_zip_track_length_m": 0.42,
    "zip_path": "胸前面の曲面上を襟元から裾へ。胸部体積に沿った曲線。",
    "open_from_top_m": [
      0,
      0.22
    ],
    "preview_open_m": 0.18,
    "max_opening_width_m": 0.12,
    "coverage": "胸元にV字の開きを作り、左右の胸と下縁は支持ライニングと革身頃で覆う。開口を広げるために身体を削らない。",
    "separation": "ジャケット裾Y1.00m、パンツ上端Y1.02mで20mm重なり。正面と背面に独立した裾/腰帯の境界を出す。",
    "waist_connector": "内側の着脱ファスナーで上下を任意接続。上衣と下衣のメッシュは常に別。",
    "helmet_included": false,
    "back_neck_height_m": 1.37
  },
  "clips_extra": [
    {
      "id": "device",
      "duration_s": 8.0,
      "loop": false,
      "description": "スマホ操作、書類を持つ、鞄を持ち替える。"
    },
    {
      "id": "zip-open-close",
      "duration_s": 6.0,
      "loop": false,
      "description": "閉→標準180mm開→最大220mm開→閉。襟と支持部の被覆を確認。"
    },
    {
      "id": "riding-pose",
      "duration_s": 6.0,
      "loop": false,
      "description": "仮シート高0.76m、前傾30度、肘曲げ60度、膝100度。肘/膝/股下を確認。バイク本体は含めない。"
    }
  ],
  "physics": {
    "common": {
      "execution": "ランタイムで継続する物理演算。GLB単体では再現不可。",
      "fixed_step_s": 0.016666666666666666,
      "substeps": 4,
      "gravity_m_s2": [
        0,
        -9.81,
        0
      ],
      "initial_settle_s": 2,
      "collision_margin_m": 0.004,
      "penetration_tolerance": "通常動作の可視貫通0。計測最大2mm未満かつ2フレーム以内。基準超過時は設定または形状を修正。"
    },
    "clothing": {
      "method": "衣装別の低解像度クロス3000–5000頂点と補助ボーンを表示へ転送。革の主身頃はスキン主体、開いた襟と遊び部に限定して物理を加える。",
      "areal_density_kg_m2": 0.75,
      "stretch_ratio_max": 1.02,
      "bend_radius_min_m": 0.005,
      "pin": "襟後ろ・肩・袖付け80–100%、腰ベルト100%、ファスナー結合部100%。胸開口の縁は裏打ち付きで保持。",
      "collision": "身体の胸・腹・骨盤・大腿・腕の追従コライダー。自己衝突ON。靴と裾の接近時も検証。",
      "range": "革の遊び部40mm、胸開口はgarment_controlsの上限で拘束。"
    },
    "breast": {
      "method": "左右独立のばね質点/補助ボーン動力学。胸郭ローカルで求解し布側コライダーへ反映。",
      "effective_mass_kg": 0.35,
      "stiffness_n_m": 260,
      "damping_n_s_m": 15,
      "max_translation_m": [
        0.003,
        0.004,
        0.003
      ],
      "max_rotation_deg": 2,
      "collision": "胸郭へのめり込み制限、左右相互衝突、衣服は追従コライダーに衝突。基準姿勢を拘束中心とする。",
      "note": "衣装の内側支持を反映。既存身体を縮小せず、元のワンピース用物理値とは衣装プリセットを分ける。"
    },
    "hair": {
      "method": "結び根元は固定、ポニーテール/編み込みを6–8節の代理チェーンで求解。元の髪長を保持。",
      "root_pin": 1,
      "max_segment_angle_deg": 25,
      "max_tip_displacement_m": 0.12,
      "collision": "頭・肩・胸・背中のカプセル。髪は服の外側4mmの代理面と衝突。",
      "damping_ratio": 0.8
    },
    "solve_order": [
      "身体アニメーションとIK",
      "胸の動力学",
      "胸コライダー更新",
      "服クロス",
      "髪動力学",
      "表示メッシュ更新"
    ]
  },
  "target": {
    "engine": "unity_hdrp",
    "exports": [
      "BLEND（衣装形状・春香リグへのバインド・衣装別物理、実装時に制作）",
      "GLB（形状・PBR・ベイクした骨アニメ）",
      "Unity用物理設定",
      "検証PNGとMP4"
    ],
    "triangles_lod0_max": 60000,
    "texture_resolution_max": 4096,
    "texture_policy": "共有材2K、主役・顔4K。BaseColor=sRGB、Normal/Roughness/Metallic=linear。AOをBaseColorへ焼き込まない。",
    "texel_density_px_per_m": 2048,
    "lod_ratios": [
      1,
      0.5,
      0.2,
      0.08
    ],
    "triangles_by_part": {
      "jacket": 20000,
      "pants": 18000,
      "gloves_boots": 17000,
      "hardware_lining": 5000
    },
    "texture_resident_budget_mib": 96,
    "engine_note": "Unity / HDRP を主想定。バージョンはモデル実装時に固定。"
  },
  "acceptance": [
    "既存春香の身体寸法と骨名を保持。衣装交換時に身体を重複表示しない。",
    "黒帯/セパレート構造など指定した意匠を全方向で確認。",
    "通常動作で可視貫通0、計測2mm未満かつ2フレーム以内。",
    "物理と補正morphのON/OFF、動作停止後の収束を録画。",
    "人体のrig、服、胸、髪のチェックは親モデル依存も含め未検証。"
  ]
}
